question,answer
"What does a field element mean in the context of Cairo?","An integer in the range 0 <= x < P, where P is a very large prime number"
"What is the value of P?","P = 2^{251} + 17 * 2^{192}+1"
"What happens when adding, subtracting, or multiplying, if the result falls outside the specified range of the prime number?","An overflow occurs, and an appropriate multiple of P is added or subtracted to bring the result back within the range"
"How is division of field elements defined in Cairo?","It is defined to always satisfy the equation (x / y) * y == x"
"What is the expected result in Cairo if y divides x as integers?","The expected result is obtained"
"What is the result of 1 / 2 in Cairo?","(P+1)/2"
"Why is the result of 1 / 2 in Cairo (P+1)/2?","Because 2 * ((P+1)/2) = P+1 ≡ 1 mod[P]"
"What is the purpose of the felt keyword in Cairo?","To specify that a variable or argument is of type field element"
"What is the maximum value that a field element can have?","P - 1"
"What is the minimum value that a field element can have?","0"
"Can a field element be negative?","No"
"What is the result of adding two field elements?","The sum of the two field elements, modulo P"
"What is the result of subtracting two field elements?","The difference of the two field elements, modulo P"
"What is the result of multiplying two field elements?","The product of the two field elements, modulo P"
"What is the result of dividing two field elements?","The field element that satisfies the equation (x / y) * y == x"
"What is the result of 5 + 7 in Cairo?","12"
"What is the result of 10 - 3 in Cairo?","7"
"What is the result of 2 * 4 in Cairo?","8"
"What is the result of 6 / 2 in Cairo?","3"
"What is the result of 0 / 7 in Cairo?","0"
"What is the result of 9 / 0 in Cairo?","An error"
"Can a field element be converted to an integer?","Yes"
"How can a field element be converted to an integer?","By taking the remainder of the field element when divided by P"
"What is the result of converting the field element 1234567890 to an integer?","1234567890"
"What is the result of converting the field element P-1 to an integer?","P-1"
"Can an integer be converted to a field element?","Yes"
"How can an integer be converted to a field element?","By taking the remainder of the integer when divided by P"
"What is the result of converting the integer 1234567890 to a field element?","1234567890"
"What is the result of converting the integer P-1 to a field element?","P-1"
"What is the difference between a field element and an integer?","Field elements wrap around when they reach P, while integers do not"
"What are the advantages of using field elements over integers?","Field elements can represent a wider range of values than integers, and they are more efficient for certain operations, such as modular arithmetic"
"What are the disadvantages of using field elements over integers?","Field elements can be more difficult to understand and use than integers, and they can be less efficient for certain operations, such as addition and subtraction"
"When should I use field elements instead of integers?","Field elements should be used when you need to represent a wide range of values or when you need to perform modular arithmetic"
"When should I use integers instead of field elements?","Integers should be used when you do not need to represent a wide range of values or when you do not need to perform modular arithmetic"
"What is modular arithmetic?","A system of arithmetic in which numbers wrap around when they reach a certain value, called the modulus"
"What is the modulus in Cairo?","P"
"What is the result of 10 + 11 in Cairo, using modular arithmetic?","21"
"What is the result of 10 - 11 in Cairo, using modular arithmetic?","P-1"
"What is the result of 10 * 11 in Cairo, using modular arithmetic?","110"
"What is the result of 10 / 11 in Cairo, using modular arithmetic?","(P+1)/11"
"What is the result of 0 / 11 in Cairo, using modular arithmetic?","0"
"What is the result of 11 / 0 in Cairo, using modular arithmetic?","An error"
"What are the advantages of using modular arithmetic?","Modular arithmetic can be used to represent a wide range of values using a small number of bits, and it can be used to perform certain operations more efficiently, such as multiplication and division"
"What are the disadvantages of using modular arithmetic?","Modular arithmetic can be more difficult to understand and use than traditional arithmetic, and it can be less efficient for certain operations, such as addition and subtraction"
"When should I use modular arithmetic?","Modular arithmetic should be used when you need to represent a wide range of values using a small number of bits, or when you need to perform certain operations more efficiently, such as multiplication and division"
"When should I not use modular arithmetic?","Modular arithmetic should not be used when you do not need to represent a wide range of values or when you do not need to perform certain operations more efficiently, such as multiplication and division"
"What is the Cairo VM?","A virtual machine that executes Cairo programs"
"What is a Cairo program?","A sequence of Cairo instructions"
"What is a Cairo instruction?","A low-level operation that the Cairo VM can perform"
"What are the different types of Cairo instructions?","There are many different types of Cairo instructions, including instructions for arithmetic operations, memory operations, control flow, and system calls"
"What is the Cairo stack?","A stack that stores data that is being processed by the Cairo VM"
"What is the Cairo heap?","A region of memory that stores data that is allocated by Cairo programs"
"What is the Cairo program counter?","A register that stores the address of the next instruction to be executed by the Cairo VM"
"What is the Cairo instruction pointer?","A register that stores the address of the current instruction being executed by the Cairo VM"
"What is the Cairo data pointer?","A register that stores the address of the current data being processed by the Cairo VM"
"What is the Cairo call stack?","A stack that stores the return addresses of Cairo functions"
"What is the Cairo exception stack?","A stack that stores the addresses of Cairo exceptions"
"What is the Cairo error stack?","A stack that stores the error messages generated by Cairo programs"
