question,answer
"What is Starkli?","A CLI tool for interacting with Starknet."
"What is Scarb?","Cairo’s package manager that compiles code to Sierra."
"What is Sierra ?","A mid-level language between Cairo and CASM."
"What is Katana?","A Starknet node, built for local development."
"How can Starkli be installed?","Using Starkliup, an installer invoked through the command line."
"What is the command to install Starkli?","curl https://get.starkli.sh | sh"
"What should be done after installing Starkli?","Restart your terminal and confirm installation."
"How do you check Starkli's version?","By running the command starkli --version."
"How can Starkli be upgraded?","By repeating the installation steps."
"Which operating systems are covered for Scarb installation?","macOS and Linux."
"What is the installation command for Scarb on macOS and Linux?","curl --proto '=https' --tlsv1.2 -sSf https://docs.swmansion.com/scarb/install.sh | sh"
"What should Windows users do to install Scarb?","Follow manual setup in the Scarb documentation."
"How do you verify Scarb installation?","Run scarb --version after restarting the terminal."
"How is Scarb upgraded?","By rerunning the installation command."
"What installer is used for Katana Node?","The dojoup installer."
"What is the command to install Katana Node?","curl -L https://install.dojoengine.org | bash"
"How do you confirm Katana Node installation?","By running katana --version after restarting the terminal."
"How is Katana Node upgraded?","By rerunning the installation command."
"What is the purpose of installing these tools?","To code in Cairo and deploy to Starknet."
"What is the role of Starkli in development?","It facilitates interaction with Starknet."
"What language is Sierra related to?","Cairo."
"What does the command 'starkliup' do?","It installs Starkli."
"What is the first step in Starkli installation?","Running the curl command for Starkli."
"Is a restart required after installing Starkli?","Yes, restart your terminal."
"Can Starkli be upgraded easily?","Yes, by repeating the installation steps."
"What is Scarb's primary function?","As a package manager for Cairo."
"Is Scarb compatible with Windows?","Yes, but requires manual setup."
"What confirms a successful Scarb installation?","Running scarb --version."
"What is the primary use of Katana?","As a Starknet node for development."
"Is a special installer used for Katana?","Yes, the dojoup installer."
"What is the verification step after Katana installation?","Running katana --version."
"What is the common method to upgrade these tools?","Rerunning the installation commands."
"Are these tools relevant for blockchain development?","Yes, for coding in Cairo and deploying to Starknet."
"What language does Scarb work with?","Cairo."
"What is Starknet?","A platform or network for which Starkli is used."
"Is Starkli a graphical interface tool?","No, it's a CLI (Command Line Interface) tool."
"Can Scarb compile code directly to CASM?","No, it compiles to Sierra, a mid-level language."
"What makes Katana unique among these tools?","It's specifically a Starknet node for local development."
"Does the installation of Starkli require internet access?","Yes, to run the curl command."
"Is Starkliup a separate software for installation?","No, it's a part of the Starkli installation process."
"How is Scarb different from Katana?","Scarb is a package manager, while Katana is a node."
"What language is used for code deployment on Starknet?","Cairo."
"Is knowledge of CASM required to use these tools?","No, Sierra acts as a mid-level language."
"Is Starkli specific to any operating system?","No specific mention is made of OS restrictions."
"What step follows running the curl command for Scarb?","Restart the terminal."
"Is manual setup for Scarb typical on Windows?","Yes, as per the documentation."
"Does Katana installation involve running a script from the internet?","Yes, using a curl command."
"What is a common step after installing all these tools?","Restarting the terminal."
"Can these tools be used for other programming languages?","They are specifically designed for Cairo."
"What is the significance of Starkli's version command?","To confirm the successful installation and version of Starkli."
"What distinguishes Starkli from traditional software installers?","Its use of a command line installer."
"What is the importance of Sierra in Cairo development?","It acts as a mid-level language between Cairo and CASM."
"Are there any prerequisites mentioned for installing these tools?","No specific prerequisites are mentioned."
"What does the command 'dojoup' do?","It installs the Katana Node."
"Is any specific version of macOS or Linux required for Scarb?","No specific version is mentioned."
"What should you do if issues arise during the declare or deploy process?","Ensure that the Starkli compiler version aligns with the Scarb compiler version."
"How can you check the supported compiler versions for Starkli?","Run 'starkli declare --help'."
"Where can you find the list of possible compiler versions for Starkli?","Under the --compiler-version flag in the output of 'starkli declare --help'."
"What is the command to check the compiler version for Scarb?","Run 'scarb --version'."
"What information does the output of 'scarb --version' display?","It displays the versions for scarb, cairo, and sierra."
"What should you do if the Scarb and Starkli compiler versions don't match?","Install a version of Scarb compatible with Starkli."
"Where can you find earlier releases of Scarb?","On Scarb's GitHub repository."
"How do you install a specific version of Scarb, like 2.3.0?","Use the command 'curl --proto '=https' --tlsv1.2 -sSf https://docs.swmansion.com/scarb/install.sh | sh -s -- -v 2.3.0'."
"What is the first step in crafting a Starknet smart contract?","Initiate a Scarb project with 'scarb new my_contract'."
"What files are in the my_contract project's structure?","src/ containing lib.cairo, .gitignore, and Scarb.toml."
"What should you add to the Scarb.toml file for a Starknet smart contract?","Integrate the starknet dependency and the starknet-contract target."
"What dependencies should be included in the Scarb.toml file?","starknet = version number"
"What is one of the primary environment variables for Starkli command execution?","An account variable for a pre-funded account on the local development network."
"What is the other essential environment variable for Starkli?","A variable designating the network, specifically the local katana devnet."
"Where should you create a .env file in the Starkli project?","In the src/ directory."
"What is the first step to check Starkli's compiler version?","Run the command 'starkli declare --help'."
"What does the '--compiler-version' flag indicate in Starkli's output?","It shows the supported statically-linked Sierra compiler versions."
"Where do you find the possible values for the COMPILER_VERSION?","Under the --compiler-version flag in the starkli output."
"Why might the Scarb's compiler version differ from Starkli's?","Because they are different tools with potentially different versioning."
"What does 'scarb <SCARB VERSION>' in the output represent?","The version of the Scarb compiler."
"What is indicated by 'cairo: <COMPILER VERSION>' in the output?","The version of the Cairo compiler used by Scarb."
"What does 'sierra: <SIERRA VERSION>' show in the output?","The version of the Sierra compiler used by Scarb."
"Why is it important for Scarb and Starkli compiler versions to match?","To ensure compatibility and avoid issues during declare or deploy processes."
"Can you find older versions of Scarb on GitHub?","Yes, Scarb's GitHub repo has earlier releases."
"Is the installation command for Scarb version specific?","Yes, you can specify the version like '2.3.0' in the installation command."
"What is the purpose of the 'scarb new my_contract' command?","It initiates a new Scarb project for a Starknet smart contract."
"What kind of file is 'lib.cairo' in the src/ directory?","It's a source file for the smart contract written in Cairo language."
"What is the purpose of the .gitignore file in the project structure?","It specifies which files or directories to ignore in Git version control."
"What is the significance of the Scarb.toml file?","It configures dependencies and targets for the Scarb project."
"What does the '>=2.3.0' signify in the dependency declaration?","It means the project requires Starknet version 2.3.0 or later."
"What does STARKNET_ACCOUNT environment variable represent?","It represents a pre-funded account on the local development network."
"Why is specifying STARKNET_RPC important?","It sets the network endpoint for Starkli to communicate with."
"How do environment variables enhance Starkli's functionality?","They provide default values for frequently used settings."
"Is the Scarb.toml file crucial for Starknet smart contract development?","Yes, it's essential for defining project dependencies and configurations."
"What role does 'starkli declare --help' play in the process?","It assists in checking the supported compiler versions for Starkli."
"What happens if the Scarb and Starkli versions are incompatible?","It might lead to issues during the declare or deploy process of smart contracts."
"How do you verify the current Scarb compiler version?","Run the command 'scarb --version'."
"Why should you check the Starkli compiler versions supported?","To ensure compatibility with the Scarb compiler version."
"Is the Scarb GitHub repository publicly accessible for version browsing?","Yes, it is accessible for browsing and downloading earlier versions."
"What does the curl command do in the context of Scarb installation?","It downloads and runs the installation script for a specific Scarb version."
"What is the purpose of creating a new Scarb project for a Starknet contract?","It sets up the initial structure and files necessary for the smart contract development."
"What is the role of the .env file in the Starkli project?","It stores environment variables for ease of configuration."
"How do you ensure the Starkli and Scarb compiler versions are aligned?","By checking and potentially installing compatible versions."
"What does the '--compiler-version' flag in starkli help with?","It helps in identifying the supported compiler versions."
"Why is it important to know the specific versions of scarb, cairo, and sierra?","To ensure compatibility and proper functioning of the tools."
"What is the main reason for specifying the Starknet version in Scarb.toml?","To set a minimum version requirement for the project."
"How does setting STARKNET_RPC to 'http://0.0.0.0:5050' help?","It configures the network endpoint for local development."
"What is the first command to use when beginning Starknet smart contract development?","'scarb new my_contract'."
"Can you customize the installation of Scarb for a specific version?","Yes, by specifying the version in the curl installation command."
"Why is the local katana devnet specified in the environment variables?","For testing and development purposes on a local network."
"What is the main benefit of aligning Starkli and Scarb versions?","It ensures smooth deployment and functionality of smart contracts."
"Is it necessary to have a pre-funded account for Starkli command execution?","Yes, it is necessary for transactions on the local development network."
"What are the two primary steps in deploying a Starknet smart contract?","Declare the contract's code and deploy an instance of that declared code."
"What tool is used to compile a Starknet smart contract?","The Scarb compiler."
"What is the command to build a contract with Scarb?","scarb build."
"Where is the compiled contract located after using the 'scarb build' command?","Under target/dev/."
"After compiling the smart contract, what is the next step?","Declare it with Starkli and katana."
"How do you set the environmental variables for your project?","By executing the command 'source .env'."
"How do you launch Katana?","Run the command 'katana' in a separate terminal."
"What is the command to declare your contract with Starkli?","starkli declare target/dev/my_contract_hello.contract_class.json."
"What does an 'Error: Invalid contract class' indicate?","A version mismatch between Scarb's compiler and Starkli."
"What should you do if you face a version mismatch error?","Refer to earlier steps to sync the versions."
"Does Starkli support the most recent Scarb version?","Typically, no; Starkli supports compiler versions approved by mainnet."
"What do you obtain upon successful execution of the declare command?","A contract class hash."
"What is the contract class hash used for?","As the identifier for your contract class within Starknet."
"Can you declare an already existing contract class?","Yes, you can proceed even if it's already declared."
"What message appears if you declare an already existing contract class?","Not declaring class as it's already declared."
"Where can you find more details about Scarb's subchapter?","In the documentation or guide you are following."
"What should you check if the 'scarb build' command doesn't work?","Ensure that Scarb is correctly installed and configured."
"Is it necessary to compile the contract before declaring it?","Yes, it is necessary."
"Can you declare a contract without compiling it first?","No, the contract needs to be compiled first."
"What does the 'source .env' command do?","It loads environmental variables from the .env file."
"Is it mandatory to use Katana for declaring a contract?","Yes, as per the given instructions."
"Can Starkli declare a contract without Katana?","No, Katana is required in this process."
"What type of error is indicated by 'Error: Invalid contract class'?","A compatibility or version error."
"What does the 'scarb build' command output?","A compiled contract."
"What is the purpose of declaring a smart contract in Starknet?","To register the contract's code within the Starknet ecosystem."
"Can multiple instances of the same declared code be deployed?","Yes, multiple instances can be deployed."
"What signifies a successful contract declaration?","Obtaining a contract class hash."
"Is it possible to declare a contract with an outdated compiler version?","No, the compiler version must be compatible with Starkli."
"How do you know if your contract class is already declared?","Starkli will indicate that the class is already declared."
"Can you rectify a version mismatch between Scarb and Starkli?","Yes, by syncing their versions as per the documentation."
"Is the contract class hash unique for each contract?","Yes, it's unique for each contract class."
"What is the importance of the .env file in this process?","It sets necessary environmental variables."
"What should you do if Katana doesn't launch?","Check the installation and configuration as per the Katana subchapter."
"Is the Scarb compiler specific to Starknet contracts?","Yes, it is specifically used for Starknet contracts."
"What does 'target/dev/' refer to in this context?","The directory where the compiled contract is stored."
"Can the contract class hash be used to deploy the contract?","No, it's used for identification, not deployment."
"What happens if you try to declare a contract with an incompatible Scarb version?","You'll face an 'Error: Invalid contract class'."
"How do you ensure the Scarb compiler and Starkli are in sync?","By following the steps outlined in the documentation."
"Can the contract class hash be considered as the contract's address?","Yes, it serves a similar purpose."
"What is the role of the Scarb compiler","To compile the smart contract code."
"Is it necessary to understand the Starkli tool for declaring contracts?","Yes, understanding Starkli is crucial."
"What should you do if you encounter problems with the Scarb compiler?","Refer to the Scarb subchapter for troubleshooting."
"Can you declare a contract class without a hash?","No, the hash is necessary for identification."
"What should be your first step if the declare command fails?","Check for version compatibility issues."
"Is the process of declaring a contract in Starknet complex?","It requires following specific steps and understanding the tools."
"Can the process of declaring a contract be automated?","Not entirely, as it involves several manual steps."
"Is Starknet specific to a certain type of smart contract?","Starknet is designed for general smart contract deployment."
"What is the significance of the Starkli tool?","It's used for declaring the compiled contract."
"Can the contract class hash be reused for different contracts?","No, each contract class has a unique hash."
"Is it possible to declare a contract without environmental variables set?","No, setting environmental variables is necessary."
"How do you handle a successful declaration?","Proceed with the next steps in your deployment process."
"Is there a way to verify the contract class hash?","Yes, by checking it against the Starknet system."
"What should you do if you receive a different error than 'Invalid contract class'?","Consult the documentation for specific error handling."
"Is it necessary to understand the entire Starknet ecosystem to declare a contract?","Understanding the basics of Starknet and its tools is necessary."
"What is the primary requirement for deploying a smart contract on the katana local devnet?","Your contract's class hash and constructor arguments."
"What type of arguments does the contract require for its constructor in the example?","A name of type felt252."
"What command structure is used to deploy a Starknet smart contract?","starkli deploy \ <CLASS_HASH> \ <CONSTRUCTOR_INPUTS>"
"In what format must the constructor inputs be for Starknet smart contracts?","In felt format."
"How can you convert a short string to a felt252 format for Starknet deployment?","By using the to-cairo-string command."
"What is the command to convert a string to felt252 format in Starknet?","starkli to-cairo-string <STRING>"
"What is the output of the command 'starkli to-cairo-string starknetbook'?","0x737461726b6e6574626f6f6b"
"How is a Starknet smart contract deployed using a class hash and constructor input?","By using the starkli deploy command with specified class hash and constructor input."
"What is the expected output after deploying a Starknet smart contract?","Details of the deployment including contract address and transaction ID."
"What are the two primary methods for interacting with Starknet contracts?","call and invoke"
"What is the purpose of the 'call' command in Starknet?","To query read-only functions of the contract."
"What is the 'starkli invoke' command used for in Starknet?","For executing functions that alter the state of the contract."
"How do you use the 'call' command to query contract functions?","By using the command structure 'starkli call \ <CONTRACT_ADDRESS> \ <FUNCTION>'"
"How is the contract address used in the 'call' command?","Replace <CONTRACT_ADDRESS> with the address of your contract."
"How are strings represented in Starknet?","Using the felt252 data type."
"What command is used to decode a felt252 string into its standard string representation?","starkli parse-cairo-string"
"What is the Starkli tool used for in the context of Starknet?","For deploying and interacting with Starknet smart contracts."
"Can the 'starkli invoke' command be used for read-only functions in Starknet?","No, it is used for functions that alter the state."
"Is it possible to transact through the 'call' command in Starknet?","No, it is for querying contract functions without transacting."
"What type of output is expected after using the 'call' command in Starknet?","The queried data in the form of a felt252 string or other format."
"Is the conversion of strings to felt252 format necessary for all Starknet deployments?","Yes, since Starknet uses felt252 format for strings."
"What indicates the successful deployment of a Starknet smart contract?","A message detailing the contract's address and deployment transaction."
"Can you alter the state of a Starknet contract without using the 'starkli invoke' command?","No, state-altering functions require the 'starkli invoke' command."
"How is a contract's class hash obtained for deployment in Starknet?","It is typically derived from the contract's compiled code."
"Is deploying a Starknet smart contract a one-step process?","No, it involves several steps including converting strings to felt252 format and using the deploy command."
"What is the purpose of the 'to-cairo-string' command in Starkli?","To convert strings into the felt252 format required by Starknet."
"Is the output of 'starkli to-cairo-string' command human-readable?","Not directly, it converts strings into hexadecimal felt252 format."
"What information do you receive about a deployed contract in Starknet?","Contract address, deployment transaction, and class hash."
"Can the 'call' command in Starknet be used to alter the contract's state?","No, it's only for read-only function queries."
"What is the significance of the 'salt' mentioned in the deployment output?","It's part of the deployment process, ensuring uniqueness of the contract's address."
"Is the deployment address of a Starknet contract predictable before deployment?","No, it is determined during the deployment process."
"How do you determine if a Starknet smart contract deployment was successful?","By checking for a confirmation message with the contract's details."
"Can the Starkli tool be used for other blockchains besides Starknet?","No, it's specifically designed for Starknet."
"Is knowledge of felt252 format necessary for interacting with Starknet contracts?","Yes, especially for interpreting outputs and providing inputs."
"What is required to deploy a smart contract on Starknet?","A class hash and constructor inputs in the correct format."
"Is the process of deploying a smart contract on Starknet complex?","It can be complex for beginners, involving multiple steps and commands."
"Does the 'starkli deploy' command immediately deploy the contract?","Yes, once provided with the correct inputs and class hash."
"Are there any prerequisites for deploying a contract on Starknet?","Yes, having the contract's class hash and prepared constructor arguments."
"What format is required for the constructor inputs in Starknet?","felt252 format."
"How is a string converted into the felt252 format for Starknet?","By using the 'starkli to-cairo-string' command."
"What is the final step in deploying a Starknet smart contract?","Running the 'starkli deploy' command with the class hash and constructor input."
"What are the two methods of interacting with a deployed Starknet contract?","Using 'call' for read-only functions and 'starkli invoke' for state-changing functions."
"How do you check a contract's state or data in Starknet?","By using the 'call' command with the appropriate contract address and function."
"Can the starkli 'starkli invoke' command be used for querying data in Starknet?","No, it's meant for functions that change the contract's state."
"What is the format of data returned by the 'call' command in Starknet?","Typically in felt252 format, representing data like strings."
"Is it possible to decode the felt252 format to a standard string?","Yes, using commands like 'starkli parse-cairo-string'."
"What does the deployment output in Starknet include?","Contract's deployment address, transaction ID, and class hash."
"Can you retrieve a Starknet contract's owner name using the 'call' command?","Yes, if the contract has a function like 'get_name' for this purpose."
"Is deploying a smart contract on Starknet similar to other blockchains?","It has similarities, but also unique aspects like felt252 format and Starkli tool usage."
"What is the first step in deploying a Starknet smart contract?","Preparing your contract's class hash and constructor arguments."
"Is familiarity with Starkli necessary for deploying and interacting with Starknet contracts?","Yes, it's an essential tool for these processes."
"What demonstrates the successful interaction with a Starknet smart contract?","Receiving the expected output or confirmation for the 'call' or 'starkli invoke' command."
"I want to invoke the set_name function of my contract, that accepts a string as parameter","
use:
    starkli invoke CONTRACT_ADDRESS set_name felt252_value
where CONTRACT_ADDRESS is the address of your contract and replace felt252_value with your parameter
"
"What is the purpose of the 'starkli invoke' command in contract management?","To alter the contract's state."
"How do you convert a string to its felt252 representation?","By using the starkli to-cairo-string command."
"What is the purpose of the starkli to-cairo-string command?","To convert a string to its felt252 representation."
"Can the 'starkli invoke' command change other fields besides 'name'?","Yes, it can be used to alter different fields in the contract."
"Is it necessary to know the contract address to use 'starkli invoke'?","Yes, the contract address is required."
"Can the 'starkli invoke' command be used to read data from the contract?","No, it is used to alter the contract's state."
"How do you find the contract address to use with 'starkli invoke'?","The contract address should be known from the contract deployment or other sources."
"Is it necessary to convert all strings to felt252 format before using them in 'starkli invoke'?","Yes, for fields that require felt252 format."
"Can the 'starkli invoke' command be executed from any command line interface?","It can be executed from interfaces where starkli is installed and configured."
"What are the security implications of using the 'starkli invoke' command?","It can alter contract state, so proper security measures and permissions are necessary."
