question,answer
"Is it possible to revert changes made using the 'starkli invoke' command?","This depends on the contract's design and blockchain functionality."
"Can the 'starkli invoke' command be automated within a script?","Yes, if the script is configured to use the starkli tool."
"What happens if an incorrect contract address is used with 'starkli invoke'?","The command would likely fail or affect the wrong contract."
"How important is accuracy when entering the felt252 value?","Very important, as incorrect values can lead to unintended contract state changes."
"What command is used to alter the contract's state?","The starkli invoke command is used to alter the contract's state."
"What function is used to update the name field in the storage?","The set_name function is used to update the name field in the storage."
"How do you provide the address of your contract in the starkli invoke command?","You provide the address of your contract in the <CONTRACT_ADDRESS> parameter."
"What format should the new value for the name field be in?","The new value for the name field should be in felt252 format."
"What command is used to convert a string to its felt252 representation?","The starkli to-cairo-string command is used for this conversion."
"Is it necessary to convert a string to felt252 format before using the starkli invoke command?","Yes, it is necessary to convert the new name to felt252 format before using the starkli invoke command."
"Is the contract address required for every starkli invoke command?","Yes, the contract address is a necessary parameter for every starkli invoke command."
"What happens if an incorrect contract address is provided in the starkli invoke command?","If an incorrect contract address is provided, the command will fail or affect a different contract unintentionally."
"Can the felt252 format represent any string?","Yes, the felt252 format can represent any string, though the conversion process is necessary."
"Is the felt252 representation of a string unique?","Yes, the felt252 representation of a string is unique."
"What is the significance of the 0x prefix in 0x4f6d6172?","The 0x prefix indicates that the following is a hexadecimal number."
"What could happen if the wrong value is provided in the <felt252> parameter in starkli invoke?","Providing the wrong value could lead to incorrect data being stored or unexpected behavior in the contract."
"Does the starkli invoke command make a permanent change to the contract's state?","Yes, it makes a permanent change to the contract's state."
"Is technical knowledge of Cairo language necessary to use starkli invoke?","Yes, technical knowledge of Cairo language and its conventions is necessary."
"Can multiple fields of a contract be updated in a single starkli invoke command?","Typically, each starkli invoke command updates a specific field, so multiple fields would require multiple commands."
"Is it possible to revert the changes made by a starkli invoke command?","Once executed, changes made by starkli invoke are permanent and cannot be reverted."
"What role does starkli play in blockchain contract management?","starkli is a tool used for interacting with and managing contracts on a blockchain that supports Cairo language."
"Can the starkli to-cairo-string command be automated in a script for multiple conversions?","Yes, it can be integrated into a script for automating multiple string conversions."
"Is prior conversion to felt252 format always required for string updates in contracts?","Yes, prior conversion to felt252 format is necessary for string updates in contracts using this method."
"How can one verify the success of the starkli invoke command?","The success can be verified by querying the contract's state after the execution of the command."
"What security considerations should be taken when using starkli invoke?","One should ensure the accuracy of the contract address and the data being sent to avoid unintended consequences."
"Can starkli invoke be used to read data from a contract?","No, starkli invoke is used for writing or updating data, not for reading."
"Is special permission required to execute the starkli invoke command on a contract?","Permission requirements depend on the contract's design and the function being invoked."
"What is the purpose of converting a string to the felt252 format?","The conversion ensures the string is in a compatible format for storing in the contract."
"Can the conversion to felt252 process alter the original string's meaning or content?","No, the conversion to felt252 is a representation change and doesn’t alter the content."
"What happens if a non-existent function name is used in the starkli invoke command?","Using a non-existent function name will result in an error and the command will not execute."
"Is the starkli tool specific to a particular type of contract or blockchain?","starkli is specific to blockchains and contracts that utilize the Cairo language."
"How can one ensure that the correct felt252 value is used in the starkli invoke command?","Double-checking the conversion output and understanding the string to be converted are key to ensuring correctness."
"How does the invoke command ensure that the update is made to the correct contract?","The invoke command uses the specific contract address provided to ensure updates are made to the correct contract."
"Can starkli invoke be used to delete data from a contract?","The ability to delete data depends on the contract's functions and design."
"Is it possible to execute multiple starkli invoke commands in a batch?","Executing multiple commands in a batch depends on the execution environment and scripting capabilities."
"How does one confirm the current state of a field in a contract before using starkli invoke?","Confirming the current state can be done through querying or reading the contract's data."
"What error handling mechanisms are in place for the starkli invoke command?","Error handling depends on the starkli tool's design and the blockchain's error reporting mechanisms."
"Can the starkli invoke command be used by anyone who has the contract address?","Whether anyone can use it depends on the contract's permissions and function access controls."
"Is there a way to simulate the starkli invoke command before actual execution?","Simulation depends on the availability of test environments or simulation features in the tool."
"What are the common mistakes to avoid when using starkli invoke?","Common mistakes include incorrect contract addresses, wrong function names, and improper data formats."
"Can starkli invoke be integrated into automated deployment scripts?","Yes, it can be integrated into automated scripts for deployment or contract management."
"Is there a way to undo an accidental invocation made using starkli invoke?","Undoing an invocation is generally not possible; actions are typically irreversible."
