question,answer
"What are the three main layers in blockchain technology?","Data availability, ordering, and execution."
"What role have Sequencers evolved to play in blockchain?","Sequencers have evolved to handle tasks within the modular landscape of blockchain technology."
"Do most L1 blockchains like Ethereum handle all blockchain tasks?","Yes, most L1 blockchains like Ethereum handle all tasks including data availability, ordering, and execution."
"What was the initial purpose of blockchains?","Initially, blockchains served as distributed virtual machines focused on organizing and executing transactions."
"In the context of Starknet, what role does Ethereum play?","Ethereum is used for data availability in the current state of Starknet."
"Can sequencing and execution be decentralized in blockchain networks like Starknet?","Yes, sequencing and execution can be decentralized, as Starknet is working towards."
"What is the main job of a Sequencer in a blockchain?","The main job of a Sequencer is to put data in a specific order."
"What are the two core tasks of sequencing in blockchain?","Sequencing involves ordering (sequencing) and executing (validation) transactions."
"What is the difference between Madara and Kraken Sequencers in Starknet?","Madara and Kraken differ in their ordering methods, mempool management, consensus options, and execution frameworks."
"What is the role of a Sequencer in the Starknet network?","In Starknet, Sequencers are responsible for ordering and executing transactions."
"What are the ordering methods used by Madara in Starknet?","FCFS, PGA, Narwhall & Bullshark."
"What is the function of the mempool in Starknet?","The mempool holds unconfirmed transactions."
"How does Madara allow developers to choose consensus protocols?","Through the use of Substrate, which offers multiple built-in options."
"What are the two execution crates offered by Madara?","Blockifier and Starknet_in_Rust."
"Which VM framework does Kraken use for execution in Starknet?","Kraken runs on Starknet_in_Rust and can use Cairo Native or Cairo VM."
"What consensus methods are available with Kraken?","Bullshark, Tendermint, or Hotstuff."
"What is the primary function of Blockifier in Starknet Sequencers?","Generating state diffs and blocks using Cairo VM."
"What distinguishes Cairo Native in Starknet's context?","Cairo Native converts Cairo’s Sierra code to MLIR."
"Why is decentralizing Sequencers important in blockchain networks?","To maintain a blockchain's original qualities and prevent centralization issues like censorship."
"How are Sequencers in Ethereum's L1 similar to validators?","Sequencers in Ethereum's L1 are responsible for creating and broadcasting blocks, similar to validators."
"What is the 'Proposer-Builder Separation' (PBS) concept in blockchain?","It divides the role of forming blocks (ordering transactions) and choosing the most profitable block to prevent transaction censorship."
"Why might centralized Sequencers be considered problematic?","Centralization risks turning the blockchain monopolistic and negates its unique advantages."
"What are the risks associated with a centralized blockchain system?","Increased risks of censorship and negation of principles like credible neutrality."
"Describe the process in a centralized validity roll-up.","Users send transactions to a centralized Sequencer, which orders them, forms a block, and sends it to a proving service. The block is then posted to L1 for verification."
"What is the downside of centralized roll-ups despite L1 security?","The significant downside is the risk of censorship."
"What are the two main functions of Sequencers in blockchain?","Ordering transactions and executing them."
"Why is the role of Sequencers significant in Layer 2 solutions?","They are crucial for achieving scalability without sacrificing decentralization."
"How do Madara and Kraken demonstrate innovation in Starknet?","They offer high-performance, customizable solutions with a range of ordering methods and execution frameworks."
"What is the significance of the discussion on 'Proposer-Builder Separation' in blockchain?","It highlights the need for role specialization to maintain system integrity and prevent transaction censorship."
"What is the role of Sequencers in maintaining blockchain's decentralized ethos?","Sequencers are crucial in balancing scalability, efficiency, and decentralization principles."
"What vulnerability might arise from L2 Sequencers performing both proposing and building roles?","Potential exposure to network vulnerabilities due to lack of role separation."
"Why is the role of Sequencers considered a linchpin in blockchain technology?","Because they play a critical role in transaction ordering and execution, crucial for network consensus and security."
"What is the challenge faced by blockchain in terms of scalability and decentralization?","The challenge is how to expand scalability without sacrificing the principle of decentralization."
"What advantages does blockchain technology lose with centralization?","Credible neutrality and resistance to monopolization."
"How does a centralized Sequencer process user transactions in a roll-up?","A centralized Sequencer selects and orders user transactions, then packages them into a block."
"What is the role of a proving service in a centralized validity roll-up?","Generating a proof for the block and posting it to Layer 1 for verification."
"Why is decentralization crucial in the context of roll-ups?","To avoid risks like censorship and to maintain the decentralized nature of blockchain technology."
"How does the modular architecture of blockchain affect the role of Sequencers?","It necessitates Sequencers to effectively link distinct layers like data availability, transaction ordering, and execution."
"What makes 'Proposer-Builder Separation' crucial in blockchain networks?","It prevents transaction censorship by separating the roles of forming and choosing blocks."
"In Starknet, how does the choice of execution crate affect the Sequencer's functionality?","Different execution crates, like Blockifier or Starknet_in_Rust, offer various ways to process and execute transactions."
"What is the purpose of consensus methods like Bullshark, Tendermint, or Hotstuff in Starknet?","These methods determine how transactions are agreed upon and added to the blockchain."
"How does the decentralization of Sequencers contribute to the blockchain's original qualities?","It helps maintain qualities like decentralization and credible neutrality, fundamental to blockchain."
"What does the 'Proposer-Builder Separation' imply for Ethereum's L1?","It suggests a division of roles to enhance transparency and prevent centralized control."
"What are the implications of centralization for blockchain technology in terms of user experience?","Centralization might lead to high costs, poor user experience, and risks like censorship."
"How does the Starknet network exemplify the potential for decentralized Sequencers?","By demonstrating the possibility of decentralizing sequencing and execution tasks."
"How does the role of Sequencers in Starknet compare to other Layer 1 blockchains?","In Starknet, Sequencers are more focused on ordering and execution, while in some L1 blockchains, these tasks are integrated."
"What is the significance of data availability in the context of blockchain layers?","Data availability is crucial for ensuring that all necessary information is accessible for transaction validation and consensus."
"How do Sequencers contribute to achieving consensus in a blockchain network?","By ordering transactions and executing them in a specific sequence, Sequencers help in achieving network consensus."
"What are the potential benefits of separating sequencing and execution tasks in blockchain?","Separating these tasks can enhance efficiency and potentially reduce the risks of errors and security vulnerabilities."
"Why is mempool management important in the context of Sequencers?","Mempool management is vital for handling unconfirmed transactions and ensuring their orderly processing."
"What role does the Cairo VM play in the context of Sequencers like Madara and Kraken?","Cairo VM is used as an execution framework, crucial for processing transactions and updating the system's state."
"What is the purpose of state diffs in the context of Starknet Sequencers?","State diffs are used for generating changes in the system's state, helping to keep the blockchain updated."
"How does the modular architecture of blockchain technology enhance scalability?","By dividing tasks among different layers, the modular architecture allows for more efficient processing, thereby enhancing scalability."
"What are the key differences between centralized and decentralized Sequencers?","Centralized Sequencers are controlled by a single entity, whereas decentralized Sequencers distribute the task among multiple participants, reducing risks like censorship."
"What is the role of transaction ordering in maintaining blockchain security?","Proper transaction ordering is essential to prevent issues like double spending and to maintain the integrity of the blockchain ledger."
"Why is the concept of 'Proposer-Builder Separation' considered innovative in blockchain?","It introduces a new level of role specialization that enhances security and prevents potential conflicts of interest."
"How does the separation of Sequencer roles contribute to the blockchain's resistance to monopolization?","By distributing responsibilities, it reduces the potential for any single entity to exert undue control over the network."
"What challenges do blockchain networks face when balancing scalability and decentralization?","The main challenge is to expand the network's capacity without centralizing control, which can compromise the foundational principles of blockchain."
"How do Starknet's Sequencers, Madara and Kraken, demonstrate customization in blockchain?","They offer a range of options for ordering methods, execution crates, and consensus protocols, allowing for tailored blockchain solutions."
"What is the importance of credible neutrality in blockchain networks?","Credible neutrality ensures that the network remains impartial and fair, which is essential for trust and security in blockchain transactions."
